post_id,title,author,score,created_utc,selftext,num_comments,top_comment
1ew1hws,[P] Illustrated book to learn about Transformers &amp; LLMs,shervinea,317,2024-08-19T13:14:52,"I have seen several instances of folks on this subreddit being interested in long-form explanations of the inner workings of Transformers &amp; LLMs.

This is a gap my twin brother and I have been aiming at filling for the past 3 1/2 years. Last week, we published “[Super Study Guide: Transformers &amp; Large Language Models](https://superstudy.guide/transformers-large-language-models/)”, a 250-page book with more than 600 illustrations aimed at visual learners who have a strong interest in getting into the field.

This book covers the following topics in depth:

* **Foundations**: primer on neural networks and important deep learning concepts for training and evaluation.
* **Embeddings**: tokenization algorithms, word embeddings (word2vec) and sentence embeddings (RNN, LSTM, GRU).
* **Transformers**: motivation behind its self-attention mechanism, detailed overview on the encoder-decoder architecture and related variations such as BERT, GPT and T5, along with tips and tricks on how to speed up computations.
* **Large language models**: main techniques to tune Transformer-based models, such as prompt engineering, (parameter efficient) finetuning and preference tuning.
* **Applications**: most common problems including sentiment extraction, machine translation, retrieval-augmented generation and many more.

(In case you are wondering: this content follows the same vibe as the Stanford illustrated study guides we had shared on this subreddit 5-6 years ago about [CS 229: Machine Learning](https://www.reddit.com/r/MachineLearning/comments/98wrkw/illustrated_machine_learning_cheatsheets_covering/), [CS 230: Deep Learning](https://www.reddit.com/r/MachineLearning/comments/a0xfc2/p_illustrated_deep_learning_cheatsheets_covering/) and [CS 221: Artificial Intelligence](https://www.reddit.com/r/MachineLearning/comments/bse25u/p_illustrated_artificial_intelligence_cheatsheets/))

Happy learning!

https://preview.redd.it/n6zraaltemjd1.jpg?width=1905&amp;format=pjpg&amp;auto=webp&amp;s=1110f750df0d8a60d5fdf1d4967b41e1b5617efe",110,Any plans to have an ebook / pdf version? I have way too many physical books and no room for more.
1jbs7xg,"[R] Transformers without Normalization (FAIR Meta, New York University, MIT, Princeton University)",Nunki08,271,2025-03-15T10:30:09,"Transformers without Normalization  
Jiachen Zhu, Xinlei Chen, Kaiming He, Yann LeCun, Zhuang Liu  
arXiv:2503.10622 \[cs.LG\]: [https://arxiv.org/abs/2503.10622](https://arxiv.org/abs/2503.10622)  
Abstract: Normalization layers are ubiquitous in modern neural networks and have long been considered essential. This work demonstrates that Transformers without normalization can achieve the same or better performance using a remarkably simple technique. We introduce Dynamic Tanh (DyT), an element-wise operation DyT(x)=tanh(αx), as a drop-in replacement for normalization layers in Transformers. DyT is inspired by the observation that layer normalization in Transformers often produces tanh-like, S-shaped input-output mappings. By incorporating DyT, Transformers without normalization can match or exceed the performance of their normalized counterparts, mostly without hyperparameter tuning. We validate the effectiveness of Transformers with DyT across diverse settings, ranging from recognition to generation, supervised to self-supervised learning, and computer vision to language models. These findings challenge the conventional understanding that normalization layers are indispensable in modern neural networks, and offer new insights into their role in deep networks.  
code and website: [https://jiachenzhu.github.io/DyT/](https://jiachenzhu.github.io/DyT/)  
Detailed thread on X by Zhuang Liu: [https://x.com/liuzhuang1234/status/1900370738588135805](https://x.com/liuzhuang1234/status/1900370738588135805)

https://preview.redd.it/c017auy7ztoe1.jpg?width=1116&amp;format=pjpg&amp;auto=webp&amp;s=e87b7d0ddd44df8f5a7f789365bf128113307539

",56,What I think this is actually doing is separating feature transformation from feature aggregation. CNNs have gone through a similar development with depthwise separable convolutions.
1hzn0gg,[D] Have transformers won in Computer Vision?,Amgadoz,194,2025-01-12T13:47:30,"Hi,

Transformers have reigned supreme in Natural Language Processing applications, both written and spoken, since BERT and GPT-1 came out in 2018.

For Computer Vision, last I checked it was starting to gain momentum in 2020 with [An Image is Worth 16x16 Words](https://arxiv.org/abs/2010.11929) but the sentiment then was ""Yeah transformers might be good for CV, for now I'll keep using my resnets""

Has this changed in 2025? Are Vision Transformers the preferred backbone for Computer Visions?

Put another way, if you were to start a new project from scratch to do image classification (medical diagnosis, etc), how would you approach it in terms of architecture and training objective?

I'm mainly an NLP guy so pardon my lack of exposure to CV problems in industry.  ",85,If you are literally *only* interested in image classification I would probably try both CNNs and vision transformers. But transformers more easily mix different modality types which is a big advantage.
13j0spj,[R] Tiny Language Models (below 10m parameters or only one transformer block) can generate paragraphs of coherent text and reason...provided training is limited to stories that only contain words that a typical 3 to 4-year-olds usually understand.,MysteryInc152,578,2023-05-16T10:00:43,Paper - https://arxiv.org/abs/2305.07759,123,"This is amazing and fascinating. I admit I had concluded that more data was a key finding of the recent LLM improvements and of course these little models don't compare with the state of the art ones, but identifying key elements that seem to make for really effective toy models is a really useful thing."
1hmitcz,[D] Everyone is so into LLMs but can the transformer architecture be used to improve more ‘traditional’ fields of machine learning ,noithatweedisloud,158,2024-12-26T06:40:47,"
i’m thinking things like recommendation algorithms, ones that rely on unsupervised learning or many other unsupervised algos 

i’ll look more into it but wanted to maybe get some thoughts on it ",87,"Transformers are already massively used in modern rec sys. A classic example is a paper from pinterest: PinnerFormer. 

More recent advancements include something like the HSTU, paper title is like “actions speak louder than words: trillion parameter…”. This is not tsfmr tho, more generative rec sys inspired from llm and etc"
1ipvau4,[D] What's the most promising successor to the Transformer?,jsonathan,177,2025-02-15T06:17:01,"All I know about is MAMBA, which looks promising from an efficiency perspective (inference is linear instead of quadratic), but AFAIK nobody's trained a big model yet. There's also [xLSTM](https://arxiv.org/pdf/2405.04517) and [Aaren](https://arxiv.org/pdf/2405.13956).

What do y'all think is the most promising alternative architecture to the transformer?",65,"Last i heard, google was working on 'Titan', prolly worth a look."
1gaxscv,[D] Transformers are a type of CNN,Ozqo,327,2024-10-24T08:31:06,"https://arxiv.org/abs/2309.10713

I was randomly googling Dynamic Convolutions since I thought they were cool and found this paper that shows transformers are equivalent to a type of CNN that uses dynamic convolutions. The dynamic convolution paper (https://arxiv.org/abs/1912.03458) was released in 2019 so it did come after the attention is all you need paper.

Sadly this paper has only one citation. I think it's incredible. Knowing that transformers can be viewed as a CNN gives them insight into optimising its design, including removing the softmax activation and replacing it with a Relu+normalisation layer. I think there's a ton more improvements that can be made by continuing their work.",65,"Transformers are everything..

Transformers are modern Hopfield Networks: https://arxiv.org/abs/2008.02217

Transformers are State Space Models: https://arxiv.org/abs/2405.21060"
12omnxo,[R] Timeline of recent Large Language Models / Transformer Models,viktorgar,771,2023-04-16T19:53:45,,86,I wonder if GPT-4 could make this graph?
t7qe6b,[R] End-to-End Referring Video Object Segmentation with Multimodal Transformers,Illustrious_Row_9971,2025,2022-03-06T03:52:43,,47,How cherry picked are these? :)
r76igz,[Discussion] (Rant) Most of us just pretend to understand Transformers,sloppybird,564,2021-12-02T12:34:57,"I see a lot of people using the concept of Attention without really knowing what's going on inside the architecture and *why* it works rather than the *how*. Others just put up the picture of attention intensity where the word ""dog"" is ""attending"" the most to ""it"". People slap on a BERT in Kaggle competitions because, well, it is easy to do so, thanks to Huggingface without really knowing what even the abbreviation means. Ask a self-proclaimed person on LinkedIn about it and he will say oh it works on attention and masking and refuses to explain further.  I'm saying all this because after searching a while for ELI5-like explanations, all I could get is a trivial description.",180,"Transformers and attention are a huge hole in my knowledge currently - for some reason I'm just super unmotivated to read about them despite the hype (been spending my time delving into normalising flows, cool shit). However, when my lab-mates are discussing ways to apply transformers to our research and I'm like ""idk what that is"" they look at me like I'm crazy so probably need to fix this lol - anyone got any good review paper recommendations?"
1kpalhd,[P] I built a transformer that skips layers per token based on semantic importance,Silent_Status_4830,165,2025-05-18T03:25:06,"I’m a high school student who’s been exploring how to make transformers/ai models more efficient, and I recently built something I’m really excited about: a transformer that routes each token through a different number of layers depending on how ""important"" it is.

The idea came from noticing how every token, even simple ones like “the” or “of”, gets pushed through every layer in standard transformers. But not every token needs the same amount of reasoning. So I created a lightweight scoring mechanism that estimates how semantically dense a token is, and based on that, decides how many layers it should go through.

It’s called SparseDepthTransformer, and here’s what it does:

* Scores each token for semantic importance
* Skips deeper layers for less important tokens using hard gating
* Tracks how many layers each token actually uses
* Benchmarks against a baseline transformer

In my tests, this reduced memory usage by about 15% and cut the average number of layers per token by \~40%, while keeping output quality the same. Right now it runs a bit slower because the skipping is done token-by-token, but batching optimization is next on my list.

Here’s the GitHub repo if you’re curious or want to give feedback:  
[https://github.com/Quinnybob/sparse-depth-transformer](https://github.com/Quinnybob/sparse-depth-transformer)

Would love if you guys check it out/want to work with me!",37,sounds similar to mixture of depths [https://arxiv.org/abs/2404.02258](https://arxiv.org/abs/2404.02258)
190q1vb,"[D] So, Mamba vs. Transformers... is the hype real?",Instantinopaul,334,2024-01-07T11:19:08,"Heard all the buzz about Mamba, the new kid on the sequence modeling block. Supposedly it's faster, handles longer sequences better, and even outperforms Transformers on some tasks. But is it really a throne-stealer or just another flash in the pan?

My perception:

Strengths: Mamba boasts efficient memory usage, linear scaling with sequence length, and impressive performance in language and DNA modeling. Plus, it ditches the attention mechanism, potentially paving the way for faster inference. 

Weaknesses: Still early days, so Mamba's long-term stability and performance across diverse tasks remain to be seen. And while it doesn't need attention, its state space approach might be trickier to grasp for some folks. 

To the AI aficionados out there, is Mamba just the next shiny toy, or a genuine paradigm shift in sequence modeling? Will it dethrone the mighty Transformer, or coexist as a specialized tool? Let's hear your thoughts!

[https://arxiv.org/abs/2312.00752](https://arxiv.org/abs/2312.00752)",110,"I’ve read the paper. The S6 layers of Mamba have a memory which they modify with each new token. All state space modeling nets work this way but the advantage here is that S6 has control over how each token is remembered (if at all), as opposed to just trying to memorize a compressed version of the entire input sequence. This means it can in theory hold on to important info from a million tokens ago while only keeping short-term details for as long as they’re needed.

Whether or not it works like that in practice for practical-sized models remains to be seen, but even if it doesn’t, more sophisticated versions of the memory state will be developed. Intuitively it makes sense for a system to accept an input one token at a time and have an internal memory (instead of just taking in the entire uncompressed sequence in one go as attention does), so I’m optimistic."
141pxvc,"[d] Apple claims M2 Ultra ""can train massive ML workloads, like large transformer models.""",jl303,282,2023-06-05T20:01:27,"Here we go again... Discussion on training model with Apple silicon.

""Finally, the 32-core Neural Engine is 40% faster. And M2 Ultra can support an enormous 192GB of unified memory, which is 50% more than M1 Ultra, enabling it to do things other chips just can't do. For example, in a single system, it can train massive ML workloads, like large transformer models that the most powerful discrete GPU can't even process because it runs out of memory.""

[WWDC 2023 — June 5](https://www.youtube.com/watch?v=GYkq9Rgoj8E&amp;t=666s)

What large transformer models are they referring? LLMs?

Even if they can fit onto memory, wouldn't it be too slow to train?",169,"Yes. I'm pretty sure it will be leaps and bounds above whatever a regular Intel chipped laptop can do, but I'd debate the usefulness of being able to fit a 100GB model into memory when you have a fraction of processing cores available vs. even a consumer grade GPU, I'm a bit unsure about the usefulness of it. 

Maybe you could fit a 100GB model into the memory and freeze all the layers except a few that you'd then train? 

Okay I'm actually starting to convince myself it could be kinda useful lol"
18qh1hp,"[Discussion] In this age of LLMs, What are the limitations of Transformer architecture and downside to it?",dontgimmehope,99,2023-12-25T11:35:07,"&amp;#x200B;

[Transformer](https://preview.redd.it/x9x11ieagf8c1.jpg?width=1320&amp;format=pjpg&amp;auto=webp&amp;s=f1a9b52c0588840352ede064575046c06a0da67e)",180,"The main limitation is the self attention mechanism's quadratic memory complexity. That is, if you want to add *n* more tokens to the context considered by the model when predicting the next token, you need *n*^2 more memory.

There's also evidence that extending the context window has decreasing marginal benefit. In other words, even if the context window could be scaled up infinitely, the model performance would eventually stall at some point, and apparently we're already closing in to that point. 

It should be noted that these considerations apply to the classic transformer architecture, and there are several proposed workarounds for both issues, though, as per my knowledge, neither is a ""solved problem"" thus far.

Edit: I should point out that the second point is an empirical observation rather than a theoretical limit."
ncdy6m,"[R] Google Replaces BERT Self-Attention with Fourier Transform: 92% Accuracy, 7 Times Faster on GPUs",Yuqing7,694,2021-05-14T17:22:45,"A research team from Google shows that replacing transformers’ self-attention sublayers with Fourier Transform achieves 92 percent of BERT accuracy on the GLUE benchmark with training times seven times faster on GPUs and twice as fast on TPUs.

Here is a quick read: [Google Replaces BERT Self-Attention with Fourier Transform: 92% Accuracy, 7 Times Faster on GPUs.](https://syncedreview.com/2021/05/14/deepmind-podracer-tpu-based-rl-frameworks-deliver-exceptional-performance-at-low-cost-19/)

The paper *FNet: Mixing Tokens with Fourier Transforms* is on [arXiv](https://arxiv.org/abs/2105.03824).",97,How much faster is BERT to train if you stop at 92% accuracy?
1lcja93,[R] Vision Transformers Don't Need Trained Registers,avd4292,74,2025-06-16T03:56:54,"Hi, we have released a new paper that studies the underlying mechanism of artifacts in attention and feature maps from [Vision Transformers Need Registers](https://arxiv.org/abs/2309.16588), a phenomena that has also been observed in LLMs (e.g., [1](https://arxiv.org/abs/2402.17762), [2](https://arxiv.org/abs/2309.17453)). We propose a training-free method to mitigate this. As one of the authors, I am creating this post to kickstart any discussion. 

Paper: [https://arxiv.org/abs/2506.08010](https://arxiv.org/abs/2506.08010)

Project Page: [https://avdravid.github.io/test-time-registers/](https://avdravid.github.io/test-time-registers/)

Code: [https://github.com/nickjiang2378/test-time-registers/tree/main](https://github.com/nickjiang2378/test-time-registers/tree/main)",21,"Very cool paper! I liked this a lot when I saw it a few days ago. Did you guys explore if this emerges in in other transformer based models (i.e. DiT, MAR, Supervised ViT)? Maybe the reason these models previously were dismissed not to have nice attention maps was due to a similar register token. It would align nicely with your Rosetta work too :)"
1jgwjjk,[D] Are GNNs obsolete because of transformers?,Master_Jello3295,109,2025-03-22T00:56:04,"I’ve always been interested in Graph Neural Networks (GNNs) but haven’t had the chance to study them deeply. Now that transformers are prevalent, the attention mechanism—where each query interacts with all keys—feels conceptually similar to operations on densely connected graphs. This makes me wonder if transformers can be considered a type of GNN. Is there any truth to this? Can transformers actually replace GNNs?",31,Transformers are GNNs on a fully connected graph of tokens and with multi-head attention as neighbourhood aggregation. This is a nice post on it: [https://graphdeeplearning.github.io/post/transformers-are-gnns/](https://graphdeeplearning.github.io/post/transformers-are-gnns/)
1g0lnij,[R] nGPT: Normalized Transformer with Representation Learning on the Hypersphere,StartledWatermelon,126,2024-10-10T15:37:27,"**Paper:** [https://arxiv.org/pdf/2410.01131](https://arxiv.org/pdf/2410.01131)

**Abstract:**

&gt;We propose a novel neural network architecture, the normalized Transformer (nGPT) with representation learning on the hypersphere. In nGPT, all vectors forming the embeddings, MLP, attention matrices and hidden states are unit norm normalized. The input stream of tokens travels on the surface of a hypersphere, with each layer contributing a displacement towards the target output predictions. These displacements are defined by the MLP and attention blocks, whose vector components also reside on the same hypersphere. Experiments show that nGPT learns much faster, reducing the number of training steps required to achieve the same accuracy by a factor of 4 to 20, depending on the sequence length.

**Highlights:**

&gt;Our key contributions are as follows:   
  
*Optimization of network parameters on the hypersphere* We propose to normalize all vectors forming the embedding dimensions of network matrices to lie on a unit norm hypersphere. This allows us to view matrix-vector multiplications as dot products representing cosine similarities bounded in \[-1,1\]. The normalization renders weight decay unnecessary.   
  
*Normalized Transformer as a variable-metric optimizer on the hypersphere* The normalized Transformer itself performs a multi-step optimization (two steps per layer) on a hypersphere, where each step of the attention and MLP updates is controlled by eigen learning rates—the diagonal elements of a learnable variable-metric matrix. For each token t\_i in the input sequence, the optimization path of the normalized Transformer begins at a point on the hypersphere corresponding to its input embedding vector and moves to a point on the hypersphere that best predicts the embedding vector of the next token t\_i+1 .   
  
*Faster convergence* We demonstrate that the normalized Transformer reduces the number of training steps required to achieve the same accuracy by a factor of 4 to 20.

**Visual Highlights:**

https://preview.redd.it/0jdj23ew6ytd1.png?width=1313&amp;format=png&amp;auto=webp&amp;s=144f4fa881d05bd1bc90faa2a0bb2c74e58c71df

[Not sure about the difference between 20k and 200k budgets; probably the best result from runs with different initial learning rates is plotted](https://preview.redd.it/8tf5tw0x6ytd1.png?width=1187&amp;format=png&amp;auto=webp&amp;s=4f9dfbe1f49bdc8aed6fa953dc9220556d7dc947)

https://preview.redd.it/waof2llr7ytd1.png?width=1337&amp;format=png&amp;auto=webp&amp;s=3f82cee29c5fe753e219edf55ab16460fcf9a11a

https://preview.redd.it/a5vburms7ytd1.png?width=859&amp;format=png&amp;auto=webp&amp;s=a3f34b73a580a5798bd5e10e9a4cc950b93fa691

",57,What is the intuition on why this performs better and whether it will scale?
1fz0pya,[R] Differential Transformer (Microsoft Research),Decent_Action2959,201,2024-10-08T14:10:25,"Abstract: Transformer tends to overallocate attention to irrelevant context. In this work, we introduce Diff Transformer, which amplifies attention to the relevant context while canceling noise. Specifically, the differential attention mechanism calculates attention scores as the difference between two separate softmax attention maps. The subtraction cancels noise, promoting the emergence of sparse attention patterns. Experimental results on language modeling show that Diff Transformer outperforms Transformer in various settings of scaling up model size and training tokens. More intriguingly, it offers notable advantages in practical applications, such as long-context modeling, key information retrieval, hallucination mitigation, in-context learning, and reduction of activation outliers. By being less distracted by irrelevant context, Diff Transformer can mitigate hallucination in question answering and text summarization. For in-context learning, Diff Transformer not only enhances accuracy but is also more robust to order permutation, which was considered as a chronic robustness issue. The results position Diff Transformer as a highly effective and promising architecture to advance large language models.",41,"Didn't really understand how you were able to differentiate the original query, key and value terms in important and noise terms. 

The changes to the actual attention calculation by subtracting the noise was clear."
1bit2f9,[D] Why do transformers use embeddings with the same dimensionality in each layer?,timtom85,126,2024-03-19T19:35:46,"My intuition is that tokens get gradually enriched as we move through the layers, but that would mean we need to store a lot less information per token in the early layers than in the later ones.

Wouldn't it make sense to start out with (relatively) low-dimensional embeddings, and then project or extend these onto higher dimensions, until they reach their final size?",86,"Maybe, but I think this would:
  - Remove the empirically very useful residual stream (is very good for training stability – it also allows [information transfer directly between non-adjacent layers](https://transformer-circuits.pub/2021/framework/index.html) mostly without affecting the intermediate layers)
  - Probably remove the model's ability to organize its embedding space into something stable across layers, removing things like [emergent outliers](https://timdettmers.com/2022/08/17/llm-int8-and-emergent-features/)
  - Not increase the amount of information at any layer – it would either stay the same as it currently is or get worse

So what would the potential benefits be? It could *maybe* reduce latency, because the matrix multiplications in early layers would be smaller, and the memory bandwidth usage would be slightly lower, but I'm not sure how significant that would be. It would also slightly reduce parameter count, as long as you didn't increase the feed-forward width of earlier layers to compensate."
11okrni,[Discussion] Compare OpenAI and SentenceTransformer Sentence Embeddings,Simusid,546,2023-03-11T13:54:22,,58,"Two quick tips for finding the best embedding models:

Sentence Transformers documentation compares models: [https://www.sbert.net/docs/pretrained\_models.html](https://www.sbert.net/docs/pretrained_models.html)

Massive Text Embedding Benchmark (MTEB) Leaderboard has 47 different models: [https://huggingface.co/spaces/mteb/leaderboard](https://huggingface.co/spaces/mteb/leaderboard)

These will help you compare different models across a lot of benchmark datasets so you can figure out the best one for your use case."
