post_id,title,author,score,created_utc,selftext,num_comments,top_comment
i49jf8,"[D] Biggest roadblock in making ""GPT-4"", a ~20 trillion parameter transformer",AxeLond,350,2020-08-05T17:21:59,"So I found this paper, [https://arxiv.org/abs/1910.02054](https://arxiv.org/abs/1910.02054) which pretty much describes how the GPT-3 over GPT-2 gain was achieved, 1.5B -&gt; 175 billion parameters

# Memory

&gt;Basic data parallelism (DP) does not reduce memory per device, and runs out of memory for models with more than 1.4B parameters on current generation of GPUs with 32 GB memory

The paper also talks about memory optimizations by clever partitioning of Optimizer State, Gradient between GPUs to reduce need for communication between nodes. Even without using Model Parallelism (MP), so still running 1 copy of the model on 1 GPU.

&gt;ZeRO-100B can train models with up to 13B parameters without MP on 128 GPUs, achieving throughput over 40 TFlops per GPU on average. In comparison, without ZeRO, the largest trainable model with DP alone has 1.4B parameters with throughput less than 20 TFlops per GPU.

Add 16-way Model Parallelism in a DGX-2 cluster of Nvidia V100s and 128 nodes and you got capacity for around 200 billion parameters. From MP = 16 they could run a 15.4x bigger model without any real loss in performance, 30% less than peak performance when running 16-way model parallelism and 64-way data parallelism (1024 GPUs).

This was all from Gradient and Optimizer state Partitioning, they then start talking about parameter partitioning and say it should offer a linear reduction in memory proportional to number of GPUs used, so 64 GPUs could run a 64x bigger model, at a 50% communication bandwidth increase. But they don't actually do any implementation or testing of this.

# Compute

Instead they start complaining about a compute power gap, their calculation of this is pretty rudimentary. But if you redo it with the method cited by GPT-3 and using the empirically derived values by GPT-3 and the cited paper,   [https://arxiv.org/abs/2001.08361](https://arxiv.org/abs/2001.08361) 

Loss (L) as a function of model parameters (N) should scale,

L = (N/8.8 \* 10\^13)\^-0.076

Provided compute (C) in petaFLOP/s-days is,

L = (C/2.3\*10\^8)\^-0.05  ⇔ L = 2.62 \* C\^-0.05

GPT-3 was able to fit this function as 2.57 \* C\^-0.048

So if you just solve C from that,

[C = 2.89407×10\^-14 N\^(19/12)](https://www.wolframalpha.com/input/?i=%28N%2F8.8*10%5E13%29%5E-0.076+%3D+2.57*C%5E-0.048+solve+C)

If you do that for the same increase in parameters as GPT-2 to GPT-3, then you get

C≈3.43×10\^7 for [20 trillion](https://www.wolframalpha.com/input/?i=C+%3D+2.89407%C3%9710%5E-14+N%5E%2819%2F12%29+and+N+%3D+175+billion+%2F+1.5+billion+*+175+billion) parameters, vs 18,300 for 175 billion. 10\^4.25 PetaFLOP/s-days looks around what they used for GPT-3, they say several thousands, not twenty thousand, but it was also slightly off the trend line in the graph and probably would have improved for training on more compute.

You should also need around 16 trillion tokens, GPT-3 trained on 300 billion tokens (function says 370 billion ideally). English Wikipedia was 3 billion. 570GB of webcrawl was 400 billion tokens, so 23TB of tokens seems relatively easy in comparison with compute.

With GPT-3 costing around [$4.6 million](https://lambdalabs.com/blog/demystifying-gpt-3/) in compute, than would put a price of [$8.6 billion](https://www.wolframalpha.com/input/?i=3.43%C3%9710%5E7%2F18%2C300+*+%244.6M+) for the compute to train ""GPT-4"".

If making bigger models was so easy with parameter partitioning from a memory point of view then this seems like the hardest challenge, but you do need to solve the memory issue to actually get it to load at all.

However, if you're lucky you can get 3-6x compute increase from Nvidia A100s over V100s,  [https://developer.nvidia.com/blog/nvidia-ampere-architecture-in-depth/](https://developer.nvidia.com/blog/nvidia-ampere-architecture-in-depth/)

But even a 6x compute gain would still put the cost at $1.4 billion.

Nvidia only reported $1.15 billion in revenue from ""Data Center"" in 2020 Q1, so just to train ""GPT-4"" you would pretty much need the entire world's supply of graphic cards for 1 quarter (3 months), at least on that order of magnitude.

The Department of Energy is paying AMD $600 million to build the 2 Exaflop El Capitan supercomputer. That supercomputer could crank it out in [47 years](https://www.wolframalpha.com/input/?i=3.43%C3%9710%5E7+petaFLOPS*+days++%2F+%282+EXAFLOPS%29).

To vastly improve Google search, and everything else it could potentially do, $1.4 billion or even $10 billion doesn't really seem impossibly bad within the next 1-3 years though.",138,If you have 8.6 billion to spend on building a language model I suggest put $5 billion into research grants. You could probably train a pretty good model with the remaining 3.6 billion and thirty thousand new research papers on language modeling.
10kdeex,"H3 - a new generative language models that outperforms GPT-Neo-2.7B with only *2* attention layers! In H3, the researchers replace attention with a new layer based on state space models (SSMs). With the right modifications, it can outperform transformers. Also has no fixed context length.",MysteryInc152,480,2023-01-24T19:11:08,,52,"Code and model weights were released

https://github.com/HazyResearch/H3"
1j7bozz,[P] Guys did my model absolutely blew Transformer?,TwoSunnySideUp,0,2025-03-09T16:45:39,"Transformer (standard):
batch = 64, block_size = 256, learning rate = 0.0003, embedding_dimension = 384, layer = 6, heads = 6, dataset = Tiny Shakespeare, max_iters = 5000, character level tokenisation

My model (standard):
same as transformer except for learning rate = 0.0032 with lr scheduler, embedding_dimension = 64, heads don't apply atleast as of now

Why nan happened during end of training, will experiment tomorrow but have some clues.

Will upload the source code after I have fixed nan issue and optimised it further.",34,This says absolutely nothing about anything 
1l68rlb,[P] BERT-Emotion: Lightweight Transformer Model (~20MB) for Real-Time Emotion Detection,boltuix_dev,27,2025-06-08T10:12:13,"Hi all,

I am sharing **BERT-Emotion**, a compact and efficient transformer model fine-tuned for short-text emotion classification. It supports **13 distinct emotions** such as Happiness, Sadness, Anger, and Love.

**Key details:**

* **Architecture**: 4-layer BERT with hidden size 128 and 4 attention heads
* **Size**: \~20MB (quantized), suitable for mobile, IoT, and edge devices
* **Parameters**: \~6 million
* Designed for offline, real-time inference with low latency
* **Licensed** under Apache-2.0, free for personal and commercial use

The model has been downloaded over **11,900 times last month**, reflecting active interest in lightweight NLP for emotion detection.

**Use cases** include mental health monitoring, social media sentiment analysis, chatbot tone analysis, and smart replies on resource constrained devices.

Model and details are available here:  
[https://huggingface.co/boltuix/bert-emotion](https://huggingface.co/boltuix/bert-emotion)

*I welcome any feedback or questions!*

For those interested, **full source code &amp; dataset are available** in a detailed walkthrough on YouTube.",13,"I think the biggest problem of such models is that they dont work for mixed emotions related to different subjects. For example how will it handle the following text review?

""I had so much trouble with other service providers that I lost all my hope for finding a reliable service provider. Luckily I found ABC XYZ LTD and they exceeded all my expectations. Of course nobody is perfect, they also have room to grow but they were pretty good for my use case."""
1lcqcd6,[D] Time series Transformers- Autogressive or all at once?,Sufficient_Sir_4730,3,2025-06-16T11:28:17,"One question I need help with, what would you recommend - predicting all 7 days (my predict length) at once or in an autoregressive manner? Which one would be more suitable for time series transformers.",12,"This is honestly one of the most debated design choices in time series transformers and the answer depends heavily on your specific use case. I work at a consulting firm that helps companies optimize their forecasting systems, and we see teams make the wrong choice on this constantly.

For 7-day forecasting, here's what actually works in practice:

All-at-once (direct multi-step) is usually better for time series transformers because:

Error accumulation kills autoregressive approaches. Each prediction becomes input for the next, so errors compound exponentially over 7 steps. Your day 7 forecast ends up being garbage.

Training efficiency is way better. You can parallelize the entire prediction sequence instead of doing sequential forward passes.

The attention mechanism in transformers is designed to capture long-range dependencies across the entire sequence, which works better when predicting all steps simultaneously.

Autoregressive only makes sense when:

You have very strong sequential dependencies where each day's prediction critically depends on the previous day's actual outcome.

Your prediction horizon is really short (1-2 steps) where error accumulation isn't a huge problem.

You're doing online learning where you can incorporate actual observations as you get them.

For 7-day forecasting specifically, go with all-at-once. The attention mechanism will capture the weekly patterns better than trying to chain predictions together.

Most successful production time series transformers use direct multi-step prediction. The only exception is when you're doing really long horizons (30+ days) where you might use a hybrid approach.

What's your specific domain? That might affect the recommendation since some industries have stronger sequential dependencies than others."
1i1l8d4,[R] Transformer²: Self-Adaptive LLMs,hardmaru,188,2025-01-15T00:41:09,"Paper: https://arxiv.org/abs/2501.06252

**Abstract**

Self-adaptive large language models (LLMs) aim to solve the challenges posed by traditional fine-tuning methods, which are often computationally intensive and static in their ability to handle diverse tasks. We introduce Transformer², a novel self-adaptation framework that adapts LLMs for unseen tasks in real-time by selectively adjusting only the singular components of their weight matrices. During inference, Transformer² employs a two-pass mechanism: first, a dispatch system identifies the task properties, and then task-specific ""expert"" vectors, trained using reinforcement learning, are dynamically mixed to obtain targeted behavior for the incoming prompt. Our method outperforms ubiquitous approaches such as LoRA, with fewer parameters and greater efficiency. Transformer² demonstrates versatility across different LLM architectures and modalities, including vision-language tasks. Transformer² represents a significant leap forward, offering a scalable, efficient solution for enhancing the adaptability and task-specific performance of LLMs, paving the way for truly dynamic, self-organizing AI systems. 

Blog Summary: https://sakana.ai/transformer-squared/

GitHub: https://github.com/SakanaAI/self-adaptive-llms",13,I think this is the first Sakana paper I've seen that didn't list you as an author. I'm interpreting that as a sign that your lab is getting bigger. Congrats!
1ib2vtx,[D] Why did DeepSeek open-source their work?,we_are_mammals,960,2025-01-27T07:48:28,"If their training is 45x more efficient, they could have dominated the LLM market. Why do you think they chose to open-source their work? How is this a net gain for their company? Now the big labs in the US can say: ""we'll take their *excellent* ideas and we'll just combine them with our *secret* ideas, and we'll still be ahead""

---

*Edit:* `DeepSeek-R1` is now ranked #1 in the LLM Arena (with `StyleCtrl`). They share this rank with 3 other models: `Gemini-Exp-1206`, `4o-latest` and `o1-2024-12-17`.",330,"Look for posts that ask, why did meta open-source their llama models?"
1ev32c0,[D] Normalization in Transformers,Collegesniffer,132,2024-08-18T06:52:16,"Why isn't BatchNorm used in transformers, and why is LayerNorm preferred instead? Additionally, why do current state-of-the-art transformer models use RMSNorm? I've typically observed that LayerNorm is used in language models, while BatchNorm is common in CNNs for vision tasks. However, why do vision-based transformer models still use LayerNorm or RMSNorm rather than BatchNorm?

",34,"In LayerNorm, for a (B, T, C) tensor, the mean and variance is computed across the channel/embedding (C) dimension for each position (T) and for each sample in batch (B). This results in (B \* T) different means and variances. The normalization is applied independently to each sample across all the channels/embeddings (C). RMSNorm operates similarly to LayerNorm but only computes the root mean square (RMS) across the channel/embedding (C) dimension for each position (T) and for each sample in batch (B). This results in (B \* T) different RMS values. The normalization is applied by dividing each sample's activations by its RMS value, without subtracting the mean, making it computationally more efficient than LayerNorm.

Since BatchNorm computes the mean and variance across the batch dimension and depends on batch size, it is not used in transformers due to variable sequence lengths in NLP. It requires storing the running mean and variance for each feature, which is memory-intensive for large models. Also, during distributed training, batch statistics need to be synced across multiple GPUs. LayerNorm is preferred not just in NLP but even in vision based transformers because it normalizes each sample independently, making it invariant to sequence length and batch size. RMSNorm operates in a very similar manner to LayerNorm but is more computationally efficient (since, unlike LayerNorm, mean subtraction is not performed and only RMS values are calculated) and can potentially lead to quicker convergence during training."
1ad1o11,[D] What are the OUTPUT embeddings in transformer? Where does it come from? (not the input embeddings),ShlomiRex,227,2024-01-28T12:31:51,,42,"Because the original architecture was designed for translation. Input Embeddings of a language to Output embeddings of another. 

Later the encoder was dropped for decoder only translation where the model simply learns to autocomplete by corrupting the training data and expecting the model to learn how to uncorrupt it. 

Surprisingly as more and more data is thrown at the network and it's scaled up, it learns interesting correlations and abilities. Even translation to the point of a context aware translation. 

You're looking at the unadulterated architecture: now we just link them together. In other words, different steps of the model but they share the same weights."
1ayog60,[D] What Are the Fundamental Drawbacks of Mamba Compared to Transformers?,Alarmed-Profile5736,111,2024-02-24T07:11:08,"Hello!

I've been pondering this question for some time. To clarify, I'm not referring to aspects like ""it hasn't been tested extensively,"" ""its scalability is uncertain,"" or ""there's a lack of industry infrastructure."" Instead, I'm interested in understanding the core differences between the transformer and Mamba architectures, specifically how these differences may place Mamba at a disadvantage compared to Transformers.

Best regards!

**Edit:**

From what I can understand from your answers, Transformers are ""better"" in the following sense compared to Mamba in that:

* Transformers does not compress the input.
* Transformers can handle non-sequential data.
* Transformer might be better to handle instructions that is located at the end of an input.

**Edit 2:**

To sum things up:

* **Transformers:** More compute for larger contexts but access to more information albeit possibly some useless information
* **Mamba:** Less compute for larger contexts but access to less information and therefore risks missing out on information.",58,Attention being O(ctx_len^2 ) has problems but is also really useful -- you can always retrieve exact sequence contents at any point in the context and can retrieve totally different values for every token. With SSMs in general and Mamba in particular you have to compress the sequence and so can do only a limited amount of retrieval on past values.
1h4urpr,[R] Simplified RNNs Achieve Transformer-Like Performance with Parallel Training and Reduced Parameters,Successful-Western27,116,2024-12-02T13:19:02,"This paper systematically examines whether RNNs might have been sufficient for many NLP tasks that are now dominated by transformers. The researchers conduct controlled experiments comparing RNNs and transformers while keeping model size, training data, and other variables constant.

Key technical points:
- Tested both architectures on language modeling and seq2seq tasks using matched parameters (70M-1.5B)
- Introduced ""RNN with Parallel Generation"" (RPG) allowing RNNs to generate tokens in parallel like transformers
- Evaluated on standard benchmarks including WikiText-103 and WMT14 En-De translation
- Analyzed representation capacity through probing tasks and attention pattern analysis

Main results:
- RNNs matched or outperformed similarly-sized transformers on WikiText-103 language modeling
- Transformers showed 1-2 BLEU score advantage on translation tasks
- RPG achieved 95% of transformer generation speed with minimal accuracy loss
- RNNs showed stronger local context modeling while transformers excelled at long-range dependencies

I think this work raises important questions about architecture choice in modern NLP. While transformers have become the default, RNNs may still be viable for many applications, especially those focused on local context. The parallel generation technique could make RNNs more practical for production deployment.

I think the results suggest we should reconsider RNNs for specific use cases rather than assuming transformers are always optimal. The computational efficiency of RNNs could be particularly valuable for resource-constrained applications.

TLDR: Comprehensive comparison shows RNNs can match transformers on some NLP tasks when controlling for model size and training. Introduces parallel generation technique for RNNs. Results suggest architecture choice should depend on specific application needs.

[Full summary is here](https://aimodels.fyi/papers/arxiv/were-rnns-all-we-needed). Paper [here](https://arxiv.org/abs/2410.01201)",22,There are some spicy comments on this paper on [openreview](https://openreview.net/forum?id=GrmFFxGnOR).
1fbavdv,[R] Adam Optimizer Causes Privileged Basis in Transformer Language Models,rrenaud,66,2024-09-07T16:26:05,,39,"I'm not sure that this blog post qualifies as research per se. It seems like cargo cult science; like, it mimics some of the aesthetics of science but lacks the corresponding substance.

The motivating statement is strange, and also wrong:

&gt; Mathematical theories of the transformer architecture do not predict this. They expect rotational equivariance within a model, where one dimension is no more important than any other. Is there something wrong with our reasonably informed intuitions of how transformers work?

Wait, what? A hypothetical mathematical theory that predicts rotational equivariance is not an intuition, it's a theorem about whose accuracy we can have no doubts. Whereas if you're operating based on intuition then that means that you don't already have a mathematical theory to support your beliefs. You have to pick one of these, it can't be both.

Also, there are no citations for this statement, presumably because it is incorrect. Mathematical theory does not predict transformers to have rotational equivariance; in fact AFAIK it predicts the opposite.

There's a good paper on this topic: [Scalars are universal: Equivariant machine learning, structured like classical physics](https://arxiv.org/abs/2106.06610). They *prove* that if a model with a bunch of vector inputs v_n has orthogonal group equivariance respect to these vectors (which is what this blog post means to say) then that model can be written as a function of only the inner products of the v_n. That's not true of transformers, which is why they're not orthogonal group equivariant.

Indeed there is a very large number of *peer reviewed* papers about the general topic of model equivariance. This blog post cites none of them, and does not seem to be aware of them. It does recommend reading this other blog post, though, which seems to be the inspiration for its content: https://transformer-circuits.pub/2023/privileged-basis/index.html

That blog post similarly appears to be cargo cult science. It cites no papers to back up its premise and provides very little mathematics to support what it's talking about; the contents are mostly hand waving. It also seems to be confused about the difference between rotational equivariance and equivariance with respect to the general linear group.

For people who are interested in this kind of stuff with respect to transformers you should take a look at this document: https://johnthickstun.com/docs/transformers.pdf . It provides a concise summary of the standard transformer model in terms of equations. It's really difficult to do any kind of meaningful reasoning about transformers without framing it in these terms.

TLDR random arxiv posts are already a pretty sketchy resource for info on ML research and that's doubly true of random blog posts."
1lb2eah,[P] Non Diverse predictions for Time Series Custom Transformer using global Zscore and RevIn,Sufficient_Sir_4730,0,2025-06-14T06:56:19,"Hi. Im currently building a custom transformer for time series forecasting ( percentage deltas) for an index. I added RevIn along with global Zscore but have this issue that predictions are almost constant (variation after 4-5 decimals for all samples). Added revin the solve the problem of index shift, but facing this issue. Any suggestions?",9,how are you sampling?
1g13gkd,[R] Differential Transformer,fliiiiiiip,231,2024-10-11T06:26:11,"### [Paper](https://arxiv.org/abs/2410.05258)

### Abstract

&gt; Transformer tends to overallocate attention to irrelevant context. 
&gt; In this work, we introduce Diff Transformer, which amplifies attention to the relevant context while canceling noise. 
&gt; Specifically, the differential attention mechanism calculates attention scores as the difference between two separate softmax attention maps.
&gt; The subtraction cancels noise, promoting the emergence of sparse attention patterns. [...]
&gt; [...] it offers notable advantages in practical applications, such as long-context modeling, key information retrieval, hallucination mitigation, in-context learning, and reduction of activation outliers. [...]",16,original post/discussion: https://www.reddit.com/r/MachineLearning/comments/1fz0pya/r_differential_transformer_microsoft_research
17cmzcz,[D] Transformers are basically CNNs?,Veson,186,2023-10-20T22:11:27,"I've watched an interesting video: [Deriving the Ultimate Neural Network Architecture from Scratch](https://www.youtube.com/watch?v=kWLed8o5M2Y). It's about how to come up to the transformer architecture when you have an understanding of CNNs.

The crux of it is an idea of pairwise convolutional layers. The first layer applies not to the sequence of words itself, but to all pairs of words in the sentence. This ensures that each relation of words that are far from each other is taken into account.

The next convolutional layer applies to all pairs of results of the previous one. This way longer subsequences of words are factored in.

[pairs of words](https://preview.redd.it/mn9yma2jfevb1.png?width=649&amp;format=png&amp;auto=webp&amp;s=15376a9db4749f437c46bf414381a34fec3806d0)

A couple of questions:

* Transformers are basically CNNs?
* Are there any articles on how transformers were invented? I see a lot of explanations of the original paper, but at best they all answer the question *how* transformers work. But *why* is the architecture the way it is? Was it discovered like the video describes? Or the path was more convoluted? I'd like to know more about this connection.

Anyway, it would be great to figure out in all details how these pairwise layers are related to the concepts of query, key, and value. Here's what the author of the video wrote on youtube:

&gt;Yeah it's a term I made up so you won't find it in any sources, sorry  about that. Usually sources will just talk about self attention in terms  of key, query and value lookups, so you can look at those to get a more  detailed understanding of the transformer. The value transform is  equivalent to the linear representation function I use in the pairwise  convolution, the key and query attention scores are equivalent to the  bi-linear form scoring function I use (with the bi-linear form weight  matrix given by Q\^TK). I chose to use this unusual terminology because,  personally, I feel the key, query and value terminology comes out of  nowhere, and I wanted to connect the transformer more directly to its  predecessor (the CNN).

Update: the author gave a deeper explanation of the math [here in the comments](https://www.reddit.com/r/MachineLearning/comments/17cmzcz/comment/k5t7g70/?context=2).",56,"The ""[attention is all you need](https://arxiv.org/abs/1706.03762)"" paper is a machine translation paper. [There's](https://arxiv.org/pdf/1702.00887.pdf) [a thread](https://arxiv.org/pdf/1508.04025.pdf) [of prior](https://arxiv.org/pdf/1409.0473.pdf) work that suggests that CNNs had very little, if at all, to do with its inspiration, and rather that it was devised to directly represent word correlations between source and target text."
